"No.","Time","Source","Destination","Protocol","Length","Info"
"1","0.000000","10.15.12.16","10.7.196.56","TLSv1","795","Application Data"
"2","0.001502","10.15.12.16","10.7.196.56","TLSv1","11483","Application Data"
"3","0.014497","10.7.196.56","10.15.12.16","TCP","60","59759  >  3389 [ACK] Seq=1 Ack=4294958572 Win=41820 Len=0"
"4","0.014849","10.7.196.56","10.15.12.16","TCP","60","59759  >  3389 [ACK] Seq=1 Ack=4294961292 Win=41820 Len=0"
"5","0.014850","10.7.196.56","10.15.12.16","TCP","60","59759  >  3389 [ACK] Seq=1 Ack=4294964012 Win=42500 Len=0"
"6","0.018924","10.7.196.56","10.15.12.16","TCP","60","59759  >  3389 [ACK] Seq=1 Ack=4294966732 Win=42160 Len=0"
"7","0.018925","10.7.196.56","10.15.12.16","TCP","60","59759  >  3389 [ACK] Seq=1 Ack=742 Win=41833 Len=0"
"8","0.018925","10.7.196.56","10.15.12.16","TCP","60","59759  >  3389 [ACK] Seq=1 Ack=3462 Win=42160 Len=0"
"9","0.018926","10.7.196.56","10.15.12.16","TCP","60","59759  >  3389 [ACK] Seq=1 Ack=6182 Win=41480 Len=0"
"10","0.018927","10.7.196.56","10.15.12.16","TCP","60","59759  >  3389 [ACK] Seq=1 Ack=8902 Win=41140 Len=0"
"11","0.018927","10.7.196.56","10.15.12.16","TCP","60","59759  >  3389 [ACK] Seq=1 Ack=11622 Win=41140 Len=0"
"12","0.020050","10.13.24.139","10.13.24.138","UDP","60","1403  >  1403 Len=4"
"13","0.026956","10.15.12.16","10.7.196.56","TLSv1","9435","Application Data"
"14","0.028893","10.15.12.16","10.7.196.56","TLSv1","10635","Application Data"
"15","0.040387","10.7.196.56","10.15.12.16","TCP","60","59759  >  3389 [ACK] Seq=1 Ack=13531 Win=40662 Len=0"
"16","0.040740","10.7.196.56","10.15.12.16","TCP","60","59759  >  3389 [ACK] Seq=1 Ack=16251 Win=40800 Len=0"
"17","0.044916","10.7.196.56","10.15.12.16","TCP","60","59759  >  3389 [ACK] Seq=1 Ack=18971 Win=40800 Len=0"
"18","0.044917","10.7.196.56","10.15.12.16","TCP","60","59759  >  3389 [ACK] Seq=1 Ack=21552 Win=41820 Len=0"
"19","0.044918","10.7.196.56","10.15.12.16","TCP","60","59759  >  3389 [ACK] Seq=1 Ack=24272 Win=41140 Len=0"
"20","0.044918","10.7.196.56","10.15.12.16","TCP","60","59759  >  3389 [ACK] Seq=1 Ack=26992 Win=40800 Len=0"
"21","0.044919","10.7.196.56","10.15.12.16","TCP","60","59759  >  3389 [ACK] Seq=1 Ack=29712 Win=40460 Len=0"
"22","0.044920","10.7.196.56","10.15.12.16","TCP","60","59759  >  3389 [ACK] Seq=1 Ack=32133 Win=40194 Len=0"
"23","0.053726","ArtesynE_30:b0:03","Broadcast","ARP","60","Who has 10.13.24.8? Tell 10.13.24.10"
"24","0.061937","10.15.12.16","10.7.196.56","TLSv1","12955","Application Data"
"25","0.062421","10.15.12.16","10.7.196.56","TLSv1","11963","Application Data"
"26","0.066013","10.15.12.16","10.7.196.56","TLSv1","8283","Application Data"
"27","0.067416","10.15.12.16","10.7.196.56","TLSv1","14747","Application Data"
"28","0.067797","10.15.12.16","10.7.196.56","TLSv1","9899","Application Data"
"29","0.076483","10.7.196.56","10.15.12.16","TCP","60","59759  >  3389 [ACK] Seq=1 Ack=34853 Win=40460 Len=0"
"30","0.076484","10.7.196.56","10.15.12.16","TCP","60","59759  >  3389 [ACK] Seq=1 Ack=37573 Win=40460 Len=0"
"31","0.076866","10.7.196.56","10.15.12.16","TCP","60","59759  >  3389 [ACK] Seq=1 Ack=40293 Win=41480 Len=0"
"32","0.080934","10.7.196.56","10.15.12.16","TCP","60","59759  >  3389 [ACK] Seq=1 Ack=43013 Win=41480 Len=0"
"33","0.080935","10.7.196.56","10.15.12.16","TCP","60","59759  >  3389 [ACK] Seq=1 Ack=45034 Win=41480 Len=0"
"34","0.080936","10.7.196.56","10.15.12.16","TCP","60","59759  >  3389 [ACK] Seq=1 Ack=47754 Win=41140 Len=0"
"35","0.080937","10.7.196.56","10.15.12.16","TCP","60","59759  >  3389 [ACK] Seq=1 Ack=50474 Win=40800 Len=0"
"36","0.080938","10.7.196.56","10.15.12.16","TCP","60","59759  >  3389 [ACK] Seq=1 Ack=53194 Win=40120 Len=0"
"37","0.081605","10.15.12.16","10.7.196.56","TLSv1","13275","Application Data"
"38","0.084732","10.7.196.56","10.15.12.16","TCP","60","59759  >  3389 [ACK] Seq=1 Ack=55914 Win=39440 Len=0"
"39","0.084733","10.7.196.56","10.15.12.16","TCP","60","59759  >  3389 [ACK] Seq=1 Ack=58303 Win=38842 Len=0"
"40","0.084734","10.7.196.56","10.15.12.16","TCP","60","59759  >  3389 [ACK] Seq=1 Ack=61023 Win=38162 Len=0"
"41","0.084977","10.15.12.16","10.7.196.56","TLSv1","2683","Application Data"
"42","0.085019","10.7.196.56","10.15.12.16","TCP","60","[TCP Window Update] 59759  >  3389 [ACK] Seq=1 Ack=61023 Win=39440 Len=0"
"43","0.085019","10.7.196.56","10.15.12.16","TCP","60","59759  >  3389 [ACK] Seq=1 Ack=63743 Win=39100 Len=0"
"44","0.085020","10.7.196.56","10.15.12.16","TCP","60","59759  >  3389 [ACK] Seq=1 Ack=65172 Win=38742 Len=0"
"45","0.085021","10.7.196.56","10.15.12.16","TCP","60","59759  >  3389 [ACK] Seq=1 Ack=67892 Win=38420 Len=0"
"46","0.086119","10.15.12.16","10.7.196.56","TLSv1","8203","Application Data"
"47","0.088683","10.7.196.56","10.15.12.16","TCP","60","59759  >  3389 [ACK] Seq=1 Ack=70612 Win=38080 Len=0"
"48","0.088684","10.7.196.56","10.15.12.16","TCP","60","59759  >  3389 [ACK] Seq=1 Ack=73332 Win=37740 Len=0"
"49","0.089065","10.7.196.56","10.15.12.16","TCP","60","59759  >  3389 [ACK] Seq=1 Ack=76052 Win=37060 Len=0"
"50","0.089066","10.7.196.56","10.15.12.16","TCP","60","[TCP Window Update] 59759  >  3389 [ACK] Seq=1 Ack=76052 Win=37400 Len=0"
"51","0.089067","10.7.196.56","10.15.12.16","TCP","60","59759  >  3389 [ACK] Seq=1 Ack=78772 Win=37060 Len=0"
"52","0.089068","10.7.196.56","10.15.12.16","TCP","60","59759  >  3389 [ACK] Seq=1 Ack=81225 Win=37060 Len=0"
"53","0.089796","10.15.12.16","10.7.196.56","TLSv1","12203","Application Data"
"54","0.092474","10.7.196.56","10.15.12.16","TCP","60","59759  >  3389 [ACK] Seq=1 Ack=83945 Win=36380 Len=0"
"55","0.092823","10.7.196.56","10.15.12.16","TCP","60","59759  >  3389 [ACK] Seq=1 Ack=86665 Win=36040 Len=0"
"56","0.092824","10.7.196.56","10.15.12.16","TCP","66","59759  >  3389 [ACK] Seq=1 Ack=88025 Win=35700 Len=0 SLE=89385 SRE=89710"
"57","0.092825","10.7.196.56","10.15.12.16","TCP","60","59759  >  3389 [ACK] Seq=1 Ack=89710 Win=35700 Len=0"
"58","0.095137","10.15.12.16","10.7.196.56","TLSv1","12971","Application Data"
"59","0.096413","10.7.196.56","10.15.12.16","TCP","60","59759  >  3389 [ACK] Seq=1 Ack=92430 Win=35020 Len=0"
"60","0.096772","10.7.196.56","10.15.12.16","TCP","60","59759  >  3389 [ACK] Seq=1 Ack=95150 Win=34680 Len=0"
"61","0.096773","10.7.196.56","10.15.12.16","TCP","60","59759  >  3389 [ACK] Seq=1 Ack=97870 Win=34340 Len=0"
"62","0.100994","10.7.196.56","10.15.12.16","TCP","60","59759  >  3389 [ACK] Seq=1 Ack=100590 Win=34000 Len=0"
"63","0.100995","10.7.196.56","10.15.12.16","TCP","60","59759  >  3389 [ACK] Seq=1 Ack=102931 Win=34000 Len=0"
"64","0.100996","10.7.196.56","10.15.12.16","TCP","60","59759  >  3389 [ACK] Seq=1 Ack=105560 Win=33342 Len=0"
"65","0.100996","10.7.196.56","10.15.12.16","TCP","60","59759  >  3389 [ACK] Seq=1 Ack=108280 Win=33320 Len=0"
"66","0.100997","10.7.196.56","10.15.12.16","TCP","60","59759  >  3389 [ACK] Seq=1 Ack=111000 Win=32980 Len=0"
"67","0.100998","10.7.196.56","10.15.12.16","TCP","60","59759  >  3389 [ACK] Seq=1 Ack=113709 Win=32302 Len=0"
"68","0.101583","10.15.12.16","10.7.196.56","TLSv1","11499","Application Data"
"69","0.104480","10.7.196.56","10.15.12.16","TCP","60","59759  >  3389 [ACK] Seq=1 Ack=116429 Win=32300 Len=0"
"70","0.104828","10.7.196.56","10.15.12.16","TCP","60","59759  >  3389 [ACK] Seq=1 Ack=119149 Win=32300 Len=0"
"71","0.104829","10.7.196.56","10.15.12.16","TCP","60","59759  >  3389 [ACK] Seq=1 Ack=121869 Win=32640 Len=0"
"72","0.108719","10.7.196.56","10.15.12.16","TCP","60","59759  >  3389 [ACK] Seq=1 Ack=124589 Win=32640 Len=0"
"73","0.108721","10.7.196.56","10.15.12.16","TCP","60","59759  >  3389 [ACK] Seq=1 Ack=127218 Win=31982 Len=0"
"74","0.108721","10.7.196.56","10.15.12.16","TCP","60","59759  >  3389 [ACK] Seq=1 Ack=129938 Win=32300 Len=0"
"75","0.111150","10.15.12.16","10.7.196.56","TLSv1","13419","Application Data"
"76","0.111447","10.15.12.16","10.7.196.56","TLSv1","6395","Application Data"
"77","0.112736","10.7.196.56","10.15.12.16","TCP","60","59759  >  3389 [ACK] Seq=1 Ack=132658 Win=32980 Len=0"
"78","0.113067","10.7.196.56","10.15.12.16","TCP","60","59759  >  3389 [ACK] Seq=1 Ack=135378 Win=32980 Len=0"
"79","0.113068","10.7.196.56","10.15.12.16","TCP","60","59759  >  3389 [ACK] Seq=1 Ack=138098 Win=32640 Len=0"
"80","0.116776","10.7.196.56","10.15.12.16","TCP","60","59759  >  3389 [ACK] Seq=1 Ack=140135 Win=32130 Len=0"
"81","0.116777","10.7.196.56","10.15.12.16","TCP","60","59759  >  3389 [ACK] Seq=1 Ack=142855 Win=32300 Len=0"
"82","0.116778","10.7.196.56","10.15.12.16","TCP","60","59759  >  3389 [ACK] Seq=1 Ack=145575 Win=32300 Len=0"
"83","0.116779","10.7.196.56","10.15.12.16","TCP","60","59759  >  3389 [ACK] Seq=1 Ack=148295 Win=34340 Len=0"
"84","0.118336","10.15.12.16","10.7.196.56","TLSv1","6891","Application Data"
"85","0.120331","10.7.196.56","10.15.12.16","TCP","60","59759  >  3389 [ACK] Seq=1 Ack=150220 Win=34340 Len=0"
"86","0.124591","10.7.196.56","10.15.12.16","TCP","60","59759  >  3389 [ACK] Seq=1 Ack=152940 Win=34000 Len=0"
"87","0.128633","10.15.12.16","10.7.196.56","TLSv1","9355","Application Data"
"88","0.128906","10.7.196.56","10.15.12.16","TCP","60","59759  >  3389 [ACK] Seq=1 Ack=155660 Win=34000 Len=0"
"89","0.128908","10.7.196.56","10.15.12.16","TCP","60","59759  >  3389 [ACK] Seq=1 Ack=158380 Win=34680 Len=0"
"90","0.128909","10.7.196.56","10.15.12.16","TCP","60","59759  >  3389 [ACK] Seq=1 Ack=161100 Win=34340 Len=0"
"91","0.128909","10.7.196.56","10.15.12.16","TCP","60","59759  >  3389 [ACK] Seq=1 Ack=163585 Win=34340 Len=0"
"92","0.128910","10.7.196.56","10.15.12.16","TCP","60","59759  >  3389 [ACK] Seq=1 Ack=166305 Win=34340 Len=0"
"93","0.128911","10.7.196.56","10.15.12.16","TCP","60","59759  >  3389 [ACK] Seq=1 Ack=169025 Win=34000 Len=0"
"94","0.132397","10.7.196.56","10.15.12.16","TCP","60","59759  >  3389 [ACK] Seq=1 Ack=171286 Win=33434 Len=0"
"95","0.132751","10.7.196.56","10.15.12.16","TCP","60","59759  >  3389 [ACK] Seq=1 Ack=174006 Win=32754 Len=0"
"96","0.132752","10.7.196.56","10.15.12.16","TCP","60","59759  >  3389 [ACK] Seq=1 Ack=176726 Win=32980 Len=0"
"97","0.140991","10.15.12.16","10.7.196.56","TLSv1","15579","Application Data"
"98","0.141158","10.15.12.16","10.7.196.56","TLSv1","2347","Application Data"
"99","0.142386","10.7.196.56","10.15.12.16","TCP","60","59759  >  3389 [ACK] Seq=1 Ack=178123 Win=32630 Len=0"
"100","0.142717","10.7.196.56","10.15.12.16","TCP","60","59759  >  3389 [ACK] Seq=1 Ack=180843 Win=31950 Len=0"
"101","0.146663","10.7.196.56","10.15.12.16","TCP","60","59759  >  3389 [ACK] Seq=1 Ack=183563 Win=31960 Len=0"
"102","0.146664","10.7.196.56","10.15.12.16","TCP","60","59759  >  3389 [ACK] Seq=1 Ack=186064 Win=31334 Len=0"
"103","0.154591","10.7.196.56","10.15.12.16","TCP","60","59759  >  3389 [ACK] Seq=1 Ack=188784 Win=31280 Len=0"
"104","0.155442","10.15.12.16","10.7.196.56","TLSv1","14091","Application Data"
"105","0.155785","10.15.12.16","10.7.196.56","TLSv1","6475","Application Data"
"106","0.158672","10.7.196.56","10.15.12.16","TCP","60","59759  >  3389 [ACK] Seq=1 Ack=191504 Win=31280 Len=0"
"107","0.159036","10.7.196.56","10.15.12.16","TCP","60","59759  >  3389 [ACK] Seq=1 Ack=194224 Win=33320 Len=0"
"108","0.159036","10.7.196.56","10.15.12.16","TCP","60","59759  >  3389 [ACK] Seq=1 Ack=196944 Win=33660 Len=0"
"109","0.159037","10.7.196.56","10.15.12.16","TCP","60","59759  >  3389 [ACK] Seq=1 Ack=199664 Win=33660 Len=0"
"110","0.159038","10.7.196.56","10.15.12.16","TCP","66","[TCP Dup ACK 109#1] 59759  >  3389 [ACK] Seq=1 Ack=199664 Win=33660 Len=0 SLE=201024 SRE=201589"
"111","0.159039","10.7.196.56","10.15.12.16","TCP","60","59759  >  3389 [ACK] Seq=1 Ack=201589 Win=33178 Len=0"
"112","0.159040","10.7.196.56","10.15.12.16","TCP","60","59759  >  3389 [ACK] Seq=1 Ack=203882 Win=33320 Len=0"
"113","0.168145","10.13.27.2","224.0.0.18","VRRP","60","Announcement (v2)"
"114","0.168146","10.13.27.2","224.0.0.18","VRRP","60","Announcement (v2)"
"115","0.168147","10.13.27.2","224.0.0.18","VRRP","60","Announcement (v2)"
"116","0.168148","10.13.27.2","224.0.0.18","VRRP","60","Announcement (v2)"
"117","0.168148","10.15.12.2","224.0.0.18","VRRP","60","Announcement (v2)"
"118","0.168149","10.13.24.2","224.0.0.18","VRRP","60","Announcement (v2)"
"119","0.170757","10.7.196.56","10.15.12.16","TCP","60","59759  >  3389 [ACK] Seq=1 Ack=206602 Win=32980 Len=0"
"120","0.170757","10.7.196.56","10.15.12.16","TCP","60","59759  >  3389 [ACK] Seq=1 Ack=209322 Win=32980 Len=0"
"121","0.170758","10.7.196.56","10.15.12.16","TCP","60","59759  >  3389 [ACK] Seq=1 Ack=212042 Win=32980 Len=0"
"122","0.171018","10.15.12.16","10.7.196.56","TLSv1","3067","Application Data"
"123","0.174857","10.7.196.56","10.15.12.16","TCP","60","59759  >  3389 [ACK] Seq=1 Ack=214762 Win=32640 Len=0"
"124","0.174858","10.7.196.56","10.15.12.16","TCP","60","59759  >  3389 [ACK] Seq=1 Ack=217482 Win=32640 Len=0"
"125","0.174859","10.7.196.56","10.15.12.16","TCP","60","59759  >  3389 [ACK] Seq=1 Ack=219279 Win=32190 Len=0"
"126","0.174860","10.7.196.56","10.15.12.16","TCP","60","59759  >  3389 [ACK] Seq=1 Ack=221999 Win=32300 Len=0"
"127","0.174861","10.7.196.56","10.15.12.16","TCP","60","59759  >  3389 [ACK] Seq=1 Ack=224340 Win=32300 Len=0"
"128","0.184603","10.7.196.56","10.15.12.16","TCP","60","59759  >  3389 [ACK] Seq=1 Ack=227060 Win=31960 Len=0"
"129","0.220037","10.13.24.139","10.13.24.138","UDP","60","1403  >  1403 Len=4"
"130","0.243733","Santera_0a:1d:8e","Broadcast","ARP","60","Who has 10.13.24.1? Tell 10.13.24.154"
"131","0.278280","10.15.12.16","10.7.196.56","TLSv1","4507","Application Data"
"132","0.292582","10.7.196.56","10.15.12.16","TCP","60","59759  >  3389 [ACK] Seq=1 Ack=228713 Win=31960 Len=0"
"133","0.292583","10.7.196.56","10.15.12.16","TCP","60","59759  >  3389 [ACK] Seq=1 Ack=231433 Win=31960 Len=0"
"134","0.360518","10.13.24.136","10.13.88.131","MEGACO","110","79503 Request |=NULL AuditValue=TDMs25c1f1/1/6/1/7"
"135","0.362451","10.13.88.131","10.13.24.136","MEGACO","135","79503 Reply   |=NULL AuditValue=TDMs25c1f1/1/6/1/7 (Mode:IN)"
"136","0.375423","10.13.27.2","224.0.0.18","VRRP","60","Announcement (v2)"
"137","0.375424","10.13.27.2","224.0.0.18","VRRP","60","Announcement (v2)"
"138","0.375425","10.13.27.2","224.0.0.18","VRRP","60","Announcement (v2)"
"139","0.375426","10.13.27.2","224.0.0.18","VRRP","60","Announcement (v2)"
"140","0.375427","10.15.12.2","224.0.0.18","VRRP","60","Announcement (v2)"
"141","0.375428","10.13.24.2","224.0.0.18","VRRP","60","Announcement (v2)"
"142","0.420081","10.13.24.139","10.13.24.138","UDP","60","1403  >  1403 Len=4"
"143","0.488654","10.7.196.56","10.15.12.16","TCP","60","59759  >  3389 [ACK] Seq=1 Ack=231806 Win=31866 Len=0"
"144","0.500092","ArtesynE_30:a4:9a","Broadcast","ARP","60","Who has 10.13.24.36? Tell 10.13.24.38"
"145","0.568145","10.13.27.2","224.0.0.18","VRRP","60","Announcement (v2)"
"146","0.568146","10.13.27.2","224.0.0.18","VRRP","60","Announcement (v2)"
"147","0.568147","10.13.27.2","224.0.0.18","VRRP","60","Announcement (v2)"
"148","0.568148","10.13.27.2","224.0.0.18","VRRP","60","Announcement (v2)"
"149","0.568149","10.15.12.2","224.0.0.18","VRRP","60","Announcement (v2)"
"150","0.568149","10.13.24.2","224.0.0.18","VRRP","60","Announcement (v2)"
"151","0.571364","10.15.12.16","10.7.196.56","TLSv1","11979","Application Data"
"152","0.572739","10.15.12.16","10.7.196.56","TLSv1","8379","Application Data"
"153","0.586469","10.7.196.56","10.15.12.16","TCP","60","59759  >  3389 [ACK] Seq=1 Ack=234526 Win=31960 Len=0"
"154","0.586826","10.7.196.56","10.15.12.16","TCP","60","59759  >  3389 [ACK] Seq=1 Ack=237246 Win=31960 Len=0"
"155","0.586827","10.7.196.56","10.15.12.16","TCP","60","59759  >  3389 [ACK] Seq=1 Ack=239966 Win=34000 Len=0"
"156","0.586827","10.7.196.56","10.15.12.16","TCP","60","59759  >  3389 [ACK] Seq=1 Ack=242686 Win=34000 Len=0"
"157","0.590809","10.7.196.56","10.15.12.16","TCP","60","59759  >  3389 [ACK] Seq=1 Ack=245091 Win=33398 Len=0"
"158","0.590809","10.7.196.56","10.15.12.16","TCP","60","59759  >  3389 [ACK] Seq=1 Ack=247811 Win=33660 Len=0"
"159","0.590810","10.7.196.56","10.15.12.16","TCP","60","59759  >  3389 [ACK] Seq=1 Ack=250531 Win=33660 Len=0"
"160","0.590811","10.7.196.56","10.15.12.16","TCP","60","59759  >  3389 [ACK] Seq=1 Ack=252056 Win=33278 Len=0"
"161","0.599900","10.15.12.16","10.7.196.56","TLSv1","12395","Application Data"
"162","0.614429","10.7.196.56","10.15.12.16","TCP","60","59759  >  3389 [ACK] Seq=1 Ack=254776 Win=33320 Len=0"
"163","0.614806","10.7.196.56","10.15.12.16","TCP","60","59759  >  3389 [ACK] Seq=1 Ack=257496 Win=33320 Len=0"
"164","0.614807","10.7.196.56","10.15.12.16","TCP","60","59759  >  3389 [ACK] Seq=1 Ack=260216 Win=35360 Len=0"
"165","0.618775","10.7.196.56","10.15.12.16","TCP","60","59759  >  3389 [ACK] Seq=1 Ack=262936 Win=35020 Len=0"
"166","0.618777","10.7.196.56","10.15.12.16","TCP","60","59759  >  3389 [ACK] Seq=1 Ack=264397 Win=35020 Len=0"
"167","0.619243","10.15.12.16","10.7.196.56","TLSv1","6971","Application Data"
"168","0.619908","10.13.24.139","10.13.24.138","UDP","60","1403  >  1403 Len=4"
"169","0.634553","10.7.196.56","10.15.12.16","TCP","60","59759  >  3389 [ACK] Seq=1 Ack=267117 Win=35020 Len=0"
"170","0.636738","10.7.196.56","10.15.12.16","TCP","60","59759  >  3389 [ACK] Seq=1 Ack=269837 Win=35020 Len=0"
"171","0.636739","10.7.196.56","10.15.12.16","TCP","66","[TCP Dup ACK 170#1] 59759  >  3389 [ACK] Seq=1 Ack=269837 Win=35020 Len=0 SLE=271197 SRE=271314"
"172","0.636740","10.7.196.56","10.15.12.16","TCP","60","59759  >  3389 [ACK] Seq=1 Ack=271314 Win=35700 Len=0"
"173","0.648919","10.15.12.16","10.7.196.56","TLSv1","3339","Application Data"
"174","0.650627","10.15.12.16","10.7.196.56","TLSv1","14507","Application Data"
"175","0.650799","10.15.12.16","10.7.196.56","TLSv1","3179","Application Data"
"176","0.662293","10.7.196.56","10.15.12.16","TCP","60","59759  >  3389 [ACK] Seq=1 Ack=274034 Win=35700 Len=0"
"177","0.666908","10.7.196.56","10.15.12.16","TCP","60","59759  >  3389 [ACK] Seq=1 Ack=275959 Win=35218 Len=0"
"178","0.666909","10.7.196.56","10.15.12.16","TCP","60","59759  >  3389 [ACK] Seq=1 Ack=278679 Win=35360 Len=0"
"179","0.666910","10.7.196.56","10.15.12.16","TCP","60","59759  >  3389 [ACK] Seq=1 Ack=281399 Win=35360 Len=0"
"180","0.666911","10.7.196.56","10.15.12.16","TCP","60","59759  >  3389 [ACK] Seq=1 Ack=284119 Win=35020 Len=0"
"181","0.666912","10.7.196.56","10.15.12.16","TCP","60","59759  >  3389 [ACK] Seq=1 Ack=286839 Win=34340 Len=0"
"182","0.666913","10.7.196.56","10.15.12.16","TCP","60","59759  >  3389 [ACK] Seq=1 Ack=289052 Win=33786 Len=0"
"183","0.670677","10.7.196.56","10.15.12.16","TCP","60","59759  >  3389 [ACK] Seq=1 Ack=291772 Win=33106 Len=0"
"184","0.670678","10.7.196.56","10.15.12.16","TCP","60","59759  >  3389 [ACK] Seq=1 Ack=292177 Win=34000 Len=0"
"185","0.745539","Santera_0a:1d:4d","Broadcast","ARP","60","Who has 10.13.24.1? Tell 10.13.24.162"
"186","0.746008","10.15.12.16","10.7.196.56","TLSv1","5595","Application Data"
"187","0.760595","10.7.196.56","10.15.12.16","TCP","60","59759  >  3389 [ACK] Seq=1 Ack=294897 Win=34000 Len=0"
"188","0.760596","10.7.196.56","10.15.12.16","TCP","66","59759  >  3389 [ACK] Seq=1 Ack=296257 Win=34000 Len=0 SLE=297617 SRE=297718"
"189","0.760597","10.7.196.56","10.15.12.16","TCP","60","59759  >  3389 [ACK] Seq=1 Ack=297718 Win=34000 Len=0"
"190","0.768271","10.13.27.2","224.0.0.18","VRRP","60","Announcement (v2)"
"191","0.768273","10.13.27.2","224.0.0.18","VRRP","60","Announcement (v2)"
"192","0.768273","10.13.27.2","224.0.0.18","VRRP","60","Announcement (v2)"
"193","0.768275","10.13.27.2","224.0.0.18","VRRP","60","Announcement (v2)"
"194","0.768275","10.15.12.2","224.0.0.18","VRRP","60","Announcement (v2)"
"195","0.768276","10.13.24.2","224.0.0.18","VRRP","60","Announcement (v2)"
"196","0.820089","10.13.24.139","10.13.24.138","UDP","60","1403  >  1403 Len=4"
"197","0.968279","10.13.27.2","224.0.0.18","VRRP","60","Announcement (v2)"
"198","0.968280","10.13.27.2","224.0.0.18","VRRP","60","Announcement (v2)"
"199","0.968281","10.13.27.2","224.0.0.18","VRRP","60","Announcement (v2)"
"200","0.968282","10.13.27.2","224.0.0.18","VRRP","60","Announcement (v2)"
"201","0.968283","10.15.12.2","224.0.0.18","VRRP","60","Announcement (v2)"
"202","0.968284","10.13.24.2","224.0.0.18","VRRP","60","Announcement (v2)"
"203","1.020038","10.13.24.139","10.13.24.138","UDP","60","1403  >  1403 Len=4"
"204","1.022455","10.13.24.138","10.13.24.139","UDP","60","1400  >  1400 Len=10"
"205","1.081989","10.15.12.16","10.7.196.56","TLSv1","11915","Application Data"
"206","1.096435","10.7.196.56","10.15.12.16","TCP","60","59759  >  3389 [ACK] Seq=1 Ack=300438 Win=34000 Len=0"
"207","1.096791","10.7.196.56","10.15.12.16","TCP","60","59759  >  3389 [ACK] Seq=1 Ack=303158 Win=34000 Len=0"
"208","1.096792","10.7.196.56","10.15.12.16","TCP","60","59759  >  3389 [ACK] Seq=1 Ack=305878 Win=35700 Len=0"
"209","1.100647","10.7.196.56","10.15.12.16","TCP","60","59759  >  3389 [ACK] Seq=1 Ack=308598 Win=35700 Len=0"
"210","1.168214","10.13.27.2","224.0.0.18","VRRP","60","Announcement (v2)"
"211","1.168215","10.13.27.2","224.0.0.18","VRRP","60","Announcement (v2)"
"212","1.168216","10.13.27.2","224.0.0.18","VRRP","60","Announcement (v2)"
"213","1.168217","10.13.27.2","224.0.0.18","VRRP","60","Announcement (v2)"
"214","1.168218","10.15.12.2","224.0.0.18","VRRP","60","Announcement (v2)"
"215","1.168219","10.13.24.2","224.0.0.18","VRRP","60","Announcement (v2)"
"216","1.183367","10.15.12.16","10.7.196.56","TLSv1","10747","Application Data"
"217","1.196337","10.7.196.56","10.15.12.16","TCP","60","59759  >  3389 [ACK] Seq=1 Ack=310939 Win=36040 Len=0"
"218","1.200773","10.7.196.56","10.15.12.16","TCP","60","59759  >  3389 [ACK] Seq=1 Ack=313659 Win=36040 Len=0"
"219","1.200774","10.7.196.56","10.15.12.16","TCP","60","59759  >  3389 [ACK] Seq=1 Ack=316379 Win=36040 Len=0"
"220","1.200775","10.7.196.56","10.15.12.16","TCP","60","59759  >  3389 [ACK] Seq=1 Ack=319099 Win=37740 Len=0"
"221","1.220082","10.13.24.139","10.13.24.138","UDP","60","1403  >  1403 Len=4"
"222","1.301587","ArtesynE_30:92:40","Broadcast","ARP","60","Who has 10.13.24.108? Tell 10.13.24.110"
"223","1.360550","10.13.24.136","10.13.88.131","MEGACO","110","79504 Request |=NULL AuditValue=TDMs25c1f1/1/6/1/8"
"224","1.362426","10.13.88.131","10.13.24.136","MEGACO","135","79504 Reply   |=NULL AuditValue=TDMs25c1f1/1/6/1/8 (Mode:IN)"
"225","1.375390","10.13.27.2","224.0.0.18","VRRP","60","Announcement (v2)"
"226","1.375391","10.13.27.2","224.0.0.18","VRRP","60","Announcement (v2)"
"227","1.375392","10.13.27.2","224.0.0.18","VRRP","60","Announcement (v2)"
"228","1.375393","10.13.27.2","224.0.0.18","VRRP","60","Announcement (v2)"
"229","1.375393","10.15.12.2","224.0.0.18","VRRP","60","Announcement (v2)"
"230","1.375394","10.13.24.2","224.0.0.18","VRRP","60","Announcement (v2)"
"231","1.390733","10.7.196.56","10.15.12.16","TCP","60","59759  >  3389 [ACK] Seq=1 Ack=320272 Win=37446 Len=0"
"232","1.420083","10.13.24.139","10.13.24.138","UDP","60","1403  >  1403 Len=4"
"233","1.568171","10.13.27.2","224.0.0.18","VRRP","60","Announcement (v2)"
"234","1.568173","10.13.27.2","224.0.0.18","VRRP","60","Announcement (v2)"
"235","1.568174","10.13.27.2","224.0.0.18","VRRP","60","Announcement (v2)"
"236","1.568174","10.13.27.2","224.0.0.18","VRRP","60","Announcement (v2)"
"237","1.568175","10.15.12.2","224.0.0.18","VRRP","60","Announcement (v2)"
"238","1.568176","10.13.24.2","224.0.0.18","VRRP","60","Announcement (v2)"
"239","1.612399","10.13.24.138","10.13.24.139","UDP","60","1403  >  1403 Len=4"
"240","1.620088","10.13.24.139","10.13.24.138","UDP","60","1403  >  1403 Len=4"
"241","1.768284","10.13.27.2","224.0.0.18","VRRP","60","Announcement (v2)"
"242","1.768286","10.13.27.2","224.0.0.18","VRRP","60","Announcement (v2)"
"243","1.768287","10.13.27.2","224.0.0.18","VRRP","60","Announcement (v2)"
"244","1.768288","10.13.27.2","224.0.0.18","VRRP","60","Announcement (v2)"
"245","1.768288","10.15.12.2","224.0.0.18","VRRP","60","Announcement (v2)"
"246","1.768289","10.13.24.2","224.0.0.18","VRRP","60","Announcement (v2)"
"247","1.820092","10.13.24.139","10.13.24.138","UDP","60","1403  >  1403 Len=4"
"248","1.918454","10.15.12.16","10.7.196.56","TLSv1","11371","Application Data"
"249","1.918633","10.15.12.16","10.7.196.56","TLSv1","3227","Application Data"
"250","1.948699","10.7.196.56","10.15.12.16","TCP","60","59759  >  3389 [ACK] Seq=1 Ack=322992 Win=37740 Len=0"
"251","1.949077","10.7.196.56","10.15.12.16","TCP","60","59759  >  3389 [ACK] Seq=1 Ack=325712 Win=37740 Len=0"
"252","1.949078","10.7.196.56","10.15.12.16","TCP","60","59759  >  3389 [ACK] Seq=1 Ack=328432 Win=39100 Len=0"
"253","1.949079","10.7.196.56","10.15.12.16","TCP","66","59759  >  3389 [ACK] Seq=1 Ack=329792 Win=39100 Len=0 SLE=331152 SRE=331589"
"254","1.949080","10.7.196.56","10.15.12.16","TCP","60","59759  >  3389 [ACK] Seq=1 Ack=331589 Win=38650 Len=0"
"255","1.949081","10.7.196.56","10.15.12.16","TCP","60","59759  >  3389 [ACK] Seq=1 Ack=334309 Win=38420 Len=0"
"256","1.968259","10.13.27.2","224.0.0.18","VRRP","60","Announcement (v2)"
"257","1.968260","10.13.27.2","224.0.0.18","VRRP","60","Announcement (v2)"
"258","1.968261","10.13.27.2","224.0.0.18","VRRP","60","Announcement (v2)"
"259","1.968262","10.13.27.2","224.0.0.18","VRRP","60","Announcement (v2)"
"260","1.968263","10.15.12.2","224.0.0.18","VRRP","60","Announcement (v2)"
"261","1.968264","10.13.24.2","224.0.0.18","VRRP","60","Announcement (v2)"
"262","2.020110","10.13.24.139","10.13.24.138","UDP","60","1403  >  1403 Len=4"
"263","2.025539","10.15.12.16","10.7.196.56","TLSv1","8491","Application Data"
"264","2.040479","10.7.196.56","10.15.12.16","TCP","60","59759  >  3389 [ACK] Seq=1 Ack=336122 Win=38420 Len=0"
"265","2.040893","10.7.196.56","10.15.12.16","TCP","60","59759  >  3389 [ACK] Seq=1 Ack=338842 Win=38420 Len=0"
"266","2.040894","10.7.196.56","10.15.12.16","TCP","60","59759  >  3389 [ACK] Seq=1 Ack=341562 Win=38420 Len=0"
"267","2.040895","10.7.196.56","10.15.12.16","TCP","60","59759  >  3389 [ACK] Seq=1 Ack=343199 Win=39780 Len=0"
"268","2.168218","10.13.27.2","224.0.0.18","VRRP","60","Announcement (v2)"
"269","2.168219","10.13.27.2","224.0.0.18","VRRP","60","Announcement (v2)"
"270","2.168220","10.13.27.2","224.0.0.18","VRRP","60","Announcement (v2)"
"271","2.168221","10.13.27.2","224.0.0.18","VRRP","60","Announcement (v2)"
"272","2.168222","10.15.12.2","224.0.0.18","VRRP","60","Announcement (v2)"
"273","2.168223","10.13.24.2","224.0.0.18","VRRP","60","Announcement (v2)"
"274","2.220098","10.13.24.139","10.13.24.138","UDP","60","1403  >  1403 Len=4"
"275","2.260816","10.13.24.136","10.13.27.13","MEGACO","104","79505 Request |=NULL ServiceChange=Root"
"276","2.260817","10.13.24.136","10.13.27.15","MEGACO","104","79506 Request |=NULL ServiceChange=Root"
"277","2.261312","10.13.24.136","10.13.27.16","MEGACO","104","79507 Request |=NULL ServiceChange=Root"
"278","2.261313","10.13.24.136","10.13.27.17","MEGACO","104","79508 Request |=NULL ServiceChange=Root"
"279","2.261702","10.13.24.136","10.13.27.20","MEGACO","104","79509 Request |=NULL ServiceChange=Root"
"280","2.261703","10.13.24.136","10.13.27.21","MEGACO","104","79510 Request |=NULL ServiceChange=Root"
"281","2.261704","10.13.24.136","10.13.27.22","MEGACO","104","79511 Request |=NULL ServiceChange=Root"
"282","2.262086","10.13.24.136","10.13.27.23","MEGACO","104","79512 Request |=NULL ServiceChange=Root"
"283","2.262087","10.13.24.136","10.13.27.14","MEGACO","104","79513 Request |=NULL ServiceChange=Root"
"284","2.262435","10.13.24.136","10.13.27.12","MEGACO","104","79514 Request |=NULL ServiceChange=Root"
"285","2.262436","10.13.27.22","10.13.24.136","MEGACO","94","79511 Reply   |=NULL SC=ROOT"
"286","2.262437","10.13.27.13","10.13.24.136","MEGACO","94","79505 Reply   |=NULL SC=ROOT"
"287","2.263073","10.13.27.22","10.13.24.136","MEGACO","218","518948 Request |=NULL SC=bct/bctpool0/* SC=audio/audiopool0/*"
"288","2.263074","10.13.27.13","10.13.24.136","MEGACO","218","520416 Request |=NULL SC=bct/bctpool0/* SC=audio/audiopool0/*"
"289","2.263075","10.13.27.20","10.13.24.136","MEGACO","94","79509 Reply   |=NULL SC=ROOT"
"290","2.263545","10.13.27.20","10.13.24.136","MEGACO","218","502354 Request |=NULL SC=bct/bctpool0/* SC=audio/audiopool0/*"
"291","2.263546","10.13.27.16","10.13.24.136","MEGACO","94","79507 Reply   |=NULL SC=ROOT"
"292","2.263547","10.13.27.16","10.13.24.136","MEGACO","218","521771 Request |=NULL SC=bct/bctpool0/* SC=audio/audiopool0/*"
"293","2.264530","10.13.27.23","10.13.24.136","MEGACO","94","79512 Reply   |=NULL SC=ROOT"
"294","2.264531","10.13.27.23","10.13.24.136","MEGACO","218","530918 Request |=NULL SC=bct/bctpool0/* SC=audio/audiopool0/*"
"295","2.265795","10.13.27.15","10.13.24.136","MEGACO","94","79506 Reply   |=NULL SC=ROOT"
"296","2.265796","10.13.27.15","10.13.24.136","MEGACO","218","527439 Request |=NULL SC=bct/bctpool0/* SC=audio/audiopool0/*"
"297","2.266105","10.13.27.17","10.13.24.136","MEGACO","94","79508 Reply   |=NULL SC=ROOT"
"298","2.266736","10.13.27.17","10.13.24.136","MEGACO","218","192460 Request |=NULL SC=bct/bctpool0/* SC=audio/audiopool0/*"
"299","2.266737","10.13.27.21","10.13.24.136","MEGACO","94","79510 Reply   |=NULL SC=ROOT"
"300","2.267233","10.13.27.21","10.13.24.136","MEGACO","218","516947 Request |=NULL SC=bct/bctpool0/* SC=audio/audiopool0/*"
"301","2.267630","10.13.27.12","10.13.24.136","MEGACO","94","79514 Reply   |=NULL SC=ROOT"
"302","2.267631","10.13.27.14","10.13.24.136","MEGACO","94","79513 Reply   |=NULL SC=ROOT"
"303","2.267632","10.13.27.12","10.13.24.136","MEGACO","218","525569 Request |=NULL SC=bct/bctpool0/* SC=audio/audiopool0/*"
"304","2.267633","10.13.27.14","10.13.24.136","MEGACO","218","108737 Request |=NULL SC=bct/bctpool0/* SC=audio/audiopool0/*"
"305","2.268774","10.13.24.136","10.13.27.22","MEGACO","120","518948 Reply   |=NULL ServiceChange=bct/bctpool0/* ServiceChange=audio/audiopool0/*"
"306","2.270418","10.13.24.136","10.13.27.13","MEGACO","120","520416 Reply   |=NULL ServiceChange=bct/bctpool0/* ServiceChange=audio/audiopool0/*"
"307","2.272555","10.13.24.136","10.13.27.20","MEGACO","120","502354 Reply   |=NULL ServiceChange=bct/bctpool0/* ServiceChange=audio/audiopool0/*"
"308","2.272556","10.13.27.22","10.13.24.136","MEGACO","81","518948 TransactionResponseAck"
"309","2.272557","10.13.27.13","10.13.24.136","MEGACO","81","520416 TransactionResponseAck"
"310","2.273220","10.13.27.20","10.13.24.136","MEGACO","81","502354 TransactionResponseAck"
"311","2.275442","10.13.24.136","10.13.27.16","MEGACO","120","521771 Reply   |=NULL ServiceChange=bct/bctpool0/* ServiceChange=audio/audiopool0/*"
"312","2.277545","10.13.24.136","10.13.27.23","MEGACO","120","530918 Reply   |=NULL ServiceChange=bct/bctpool0/* ServiceChange=audio/audiopool0/*"
"313","2.278461","10.13.27.16","10.13.24.136","MEGACO","81","521771 TransactionResponseAck"
"314","2.279432","10.13.27.23","10.13.24.136","MEGACO","81","530918 TransactionResponseAck"
"315","2.279865","10.13.24.136","10.13.27.15","MEGACO","120","527439 Reply   |=NULL ServiceChange=bct/bctpool0/* ServiceChange=audio/audiopool0/*"
"316","2.280717","10.13.27.15","10.13.24.136","MEGACO","81","527439 TransactionResponseAck"
"317","2.282128","10.13.24.136","10.13.27.17","MEGACO","120","192460 Reply   |=NULL ServiceChange=bct/bctpool0/* ServiceChange=audio/audiopool0/*"
"318","2.284184","10.13.24.136","10.13.27.21","MEGACO","120","516947 Reply   |=NULL ServiceChange=bct/bctpool0/* ServiceChange=audio/audiopool0/*"
"319","2.286340","10.13.27.17","10.13.24.136","MEGACO","81","192460 TransactionResponseAck"
"320","2.286801","10.13.27.21","10.13.24.136","MEGACO","81","516947 TransactionResponseAck"
"321","2.286802","10.13.24.136","10.13.27.12","MEGACO","120","525569 Reply   |=NULL ServiceChange=bct/bctpool0/* ServiceChange=audio/audiopool0/*"
"322","2.288625","10.13.24.136","10.13.27.14","MEGACO","120","108737 Reply   |=NULL ServiceChange=bct/bctpool0/* ServiceChange=audio/audiopool0/*"
"323","2.292425","10.13.27.12","10.13.24.136","MEGACO","81","525569 TransactionResponseAck"
"324","2.292426","10.13.27.14","10.13.24.136","MEGACO","81","108737 TransactionResponseAck"
"325","2.355616","10.15.12.16","10.7.196.56","TLSv1","12603","Application Data"
"326","2.360059","10.13.24.136","10.13.88.131","MEGACO","110","79515 Request |=NULL AuditValue=TDMs25c1f1/1/6/1/9"
"327","2.362271","10.13.88.131","10.13.24.136","MEGACO","135","79515 Reply   |=NULL AuditValue=TDMs25c1f1/1/6/1/9 (Mode:IN)"
"328","2.370772","10.7.196.56","10.15.12.16","TCP","60","59759  >  3389 [ACK] Seq=1 Ack=345919 Win=39780 Len=0"
"329","2.370773","10.7.196.56","10.15.12.16","TCP","60","59759  >  3389 [ACK] Seq=1 Ack=348639 Win=39780 Len=0"
"330","2.370774","10.7.196.56","10.15.12.16","TCP","60","59759  >  3389 [ACK] Seq=1 Ack=351359 Win=40800 Len=0"
"331","2.374794","10.7.196.56","10.15.12.16","TCP","60","59759  >  3389 [ACK] Seq=1 Ack=354079 Win=40800 Len=0"
"332","2.374795","10.7.196.56","10.15.12.16","TCP","66","[TCP Dup ACK 331#1] 59759  >  3389 [ACK] Seq=1 Ack=354079 Win=40800 Len=0 SLE=355439 SRE=355748"
"333","2.374796","10.7.196.56","10.15.12.16","TCP","60","59759  >  3389 [ACK] Seq=1 Ack=355748 Win=40800 Len=0"
"334","2.375845","10.13.27.2","224.0.0.18","VRRP","60","Announcement (v2)"
"335","2.375846","10.13.27.2","224.0.0.18","VRRP","60","Announcement (v2)"
"336","2.375847","10.13.27.2","224.0.0.18","VRRP","60","Announcement (v2)"
"337","2.375848","10.13.27.2","224.0.0.18","VRRP","60","Announcement (v2)"
"338","2.375848","10.15.12.2","224.0.0.18","VRRP","60","Announcement (v2)"
"339","2.375850","10.13.24.2","224.0.0.18","VRRP","60","Announcement (v2)"
"340","2.420089","10.13.24.139","10.13.24.138","UDP","60","1403  >  1403 Len=4"
"341","2.430597","10.13.24.139","10.13.24.138","TCP","120","22535  >  33199 [PSH, ACK] Seq=1 Ack=1 Win=11134 Len=66"
"342","2.461744","10.15.12.16","10.7.196.56","TLSv1","795","Application Data"
"343","2.532412","10.13.24.138","10.13.24.139","TCP","60","33199  >  22535 [ACK] Seq=1 Ack=67 Win=11614 Len=0"
"344","2.532814","10.13.24.139","10.13.24.138","TCP","1514","22535  >  33199 [ACK] Seq=67 Ack=1 Win=11134 Len=1460"
"345","2.532816","10.13.24.139","10.13.24.138","TCP","1514","22535  >  33199 [ACK] Seq=1527 Ack=1 Win=11134 Len=1460"
"346","2.532817","10.13.24.139","10.13.24.138","TCP","728","22535  >  33199 [PSH, ACK] Seq=2987 Ack=1 Win=11134 Len=674"
"347","2.533935","10.13.24.138","10.13.24.139","TCP","60","33199  >  22535 [ACK] Seq=1 Ack=2987 Win=8694 Len=0"
"348","2.534591","10.13.24.138","10.13.24.139","TCP","60","33199  >  22535 [ACK] Seq=1 Ack=3661 Win=9484 Len=0"
"349","2.535390","10.13.24.138","10.13.24.139","TCP","60","[TCP Window Update] 33199  >  22535 [ACK] Seq=1 Ack=3661 Win=10948 Len=0"
"350","2.568222","10.13.27.2","224.0.0.18","VRRP","60","Announcement (v2)"
"351","2.568223","10.13.27.2","224.0.0.18","VRRP","60","Announcement (v2)"
"352","2.568224","10.13.27.2","224.0.0.18","VRRP","60","Announcement (v2)"
"353","2.568225","10.13.27.2","224.0.0.18","VRRP","60","Announcement (v2)"
"354","2.568226","10.15.12.2","224.0.0.18","VRRP","60","Announcement (v2)"
"355","2.568226","10.13.24.2","224.0.0.18","VRRP","60","Announcement (v2)"
"356","2.569874","Santera_0a:1d:83","Broadcast","ARP","60","Who has 10.13.24.156? Tell 10.13.24.158"
"357","2.609400","ArtesynE_30:92:04","Broadcast","ARP","60","Who has 10.13.24.76? Tell 10.13.24.78"
"358","2.620097","10.13.24.139","10.13.24.138","UDP","60","1403  >  1403 Len=4"
"359","2.672662","10.7.196.56","10.15.12.16","TCP","60","59759  >  3389 [ACK] Seq=1 Ack=356489 Win=40614 Len=0"
"360","2.748792","ArtesynE_30:92:2e","Broadcast","ARP","60","Who has 10.13.24.140? Tell 10.13.24.142"
"361","2.771329","10.13.27.2","224.0.0.18","VRRP","60","Announcement (v2)"
"362","2.771330","10.13.27.2","224.0.0.18","VRRP","60","Announcement (v2)"
"363","2.771331","10.13.27.2","224.0.0.18","VRRP","60","Announcement (v2)"
"364","2.771332","10.13.27.2","224.0.0.18","VRRP","60","Announcement (v2)"
"365","2.771333","10.15.12.2","224.0.0.18","VRRP","60","Announcement (v2)"
"366","2.771334","10.13.24.2","224.0.0.18","VRRP","60","Announcement (v2)"
"367","2.820107","10.13.24.139","10.13.24.138","UDP","60","1403  >  1403 Len=4"
"368","2.968239","10.13.27.2","224.0.0.18","VRRP","60","Announcement (v2)"
"369","2.968240","10.13.27.2","224.0.0.18","VRRP","60","Announcement (v2)"
"370","2.968241","10.13.27.2","224.0.0.18","VRRP","60","Announcement (v2)"
"371","2.968242","10.13.27.2","224.0.0.18","VRRP","60","Announcement (v2)"
"372","2.968243","10.15.12.2","224.0.0.18","VRRP","60","Announcement (v2)"
"373","2.968244","10.13.24.2","224.0.0.18","VRRP","60","Announcement (v2)"
"374","2.997276","10.15.12.16","10.7.196.56","TLSv1","11659","Application Data"
"375","3.004699","ArtesynE_2c:b3:f3","Broadcast","ARP","60","Who has 10.13.24.12? Tell 10.13.24.14"
"376","3.012901","10.7.196.56","10.15.12.16","TCP","60","59759  >  3389 [ACK] Seq=1 Ack=359209 Win=40800 Len=0"
"377","3.012902","10.7.196.56","10.15.12.16","TCP","60","59759  >  3389 [ACK] Seq=1 Ack=361929 Win=40800 Len=0"
"378","3.012903","10.7.196.56","10.15.12.16","TCP","60","59759  >  3389 [ACK] Seq=1 Ack=364649 Win=41820 Len=0"
"379","3.016657","10.7.196.56","10.15.12.16","TCP","60","59759  >  3389 [ACK] Seq=1 Ack=367369 Win=41480 Len=0"
"380","3.020094","10.13.24.139","10.13.24.138","UDP","60","1403  >  1403 Len=4"
"381","3.102225","10.15.12.16","10.7.196.56","TLSv1","12155","Application Data"
"382","3.116575","10.7.196.56","10.15.12.16","TCP","60","59759  >  3389 [ACK] Seq=1 Ack=369454 Win=41480 Len=0"
"383","3.116576","10.7.196.56","10.15.12.16","TCP","60","59759  >  3389 [ACK] Seq=1 Ack=372174 Win=41480 Len=0"
"384","3.116577","10.7.196.56","10.15.12.16","TCP","60","59759  >  3389 [ACK] Seq=1 Ack=374894 Win=41480 Len=0"
"385","3.120790","10.7.196.56","10.15.12.16","TCP","60","59759  >  3389 [ACK] Seq=1 Ack=377614 Win=42500 Len=0"
"386","3.120792","10.7.196.56","10.15.12.16","TCP","60","59759  >  3389 [ACK] Seq=1 Ack=380195 Win=41854 Len=0"
"387","3.168216","10.13.27.2","224.0.0.18","VRRP","60","Announcement (v2)"
"388","3.168217","10.13.27.2","224.0.0.18","VRRP","60","Announcement (v2)"
"389","3.168218","10.13.27.2","224.0.0.18","VRRP","60","Announcement (v2)"
"390","3.168219","10.13.27.2","224.0.0.18","VRRP","60","Announcement (v2)"
"391","3.168220","10.15.12.2","224.0.0.18","VRRP","60","Announcement (v2)"
"392","3.168221","10.13.24.2","224.0.0.18","VRRP","60","Announcement (v2)"
"393","3.220107","10.13.24.139","10.13.24.138","UDP","60","1403  >  1403 Len=4"
"394","3.264955","10.13.25.13","10.13.24.136","UDP","70","4684  >  4684 Len=28"
"395","3.360989","10.13.24.136","10.13.88.131","MEGACO","111","79516 Request |=NULL AuditValue=TDMs25c1f1/1/6/1/10"
"396","3.362896","10.13.88.131","10.13.24.136","MEGACO","136","79516 Reply   |=NULL AuditValue=TDMs25c1f1/1/6/1/10 (Mode:IN)"
"397","3.375090","10.13.27.2","224.0.0.18","VRRP","60","Announcement (v2)"
"398","3.375091","10.13.27.2","224.0.0.18","VRRP","60","Announcement (v2)"
"399","3.375092","10.13.27.2","224.0.0.18","VRRP","60","Announcement (v2)"
"400","3.375093","10.13.27.2","224.0.0.18","VRRP","60","Announcement (v2)"
"401","3.375094","10.15.12.2","224.0.0.18","VRRP","60","Announcement (v2)"
"402","3.375095","10.13.24.2","224.0.0.18","VRRP","60","Announcement (v2)"
"403","3.420120","10.13.24.139","10.13.24.138","UDP","60","1403  >  1403 Len=4"
"404","3.568159","10.13.27.2","224.0.0.18","VRRP","60","Announcement (v2)"
"405","3.568160","10.13.27.2","224.0.0.18","VRRP","60","Announcement (v2)"
"406","3.568161","10.13.27.2","224.0.0.18","VRRP","60","Announcement (v2)"
"407","3.568162","10.13.27.2","224.0.0.18","VRRP","60","Announcement (v2)"
"408","3.568163","10.15.12.2","224.0.0.18","VRRP","60","Announcement (v2)"
"409","3.568164","10.13.24.2","224.0.0.18","VRRP","60","Announcement (v2)"
"410","3.620121","10.13.24.139","10.13.24.138","UDP","60","1403  >  1403 Len=4"
